{
  "$schema": "http://json-schema.org/draft-07/schema#",
  "$id": "https://pentest-lyan/account.schema.json",
  "title": "sessions/account_{role}.json",
  "type": "object",
  "additionalProperties": false,
  "required": [
    "role",
    "username",
    "role_level",
    "login_time",
    "last_used",
    "auth_material",
    "identity",
    "status"
  ],
  "properties": {
    "role": {
      "type": "string"
    },
    "username": {
      "type": "string"
    },
    "role_level": {
      "type": "string",
      "enum": [
        "high_privilege",
        "standard",
        "low"
      ]
    },
    "login_time": {
      "$ref": "common.schema.json#/definitions/date_time"
    },
    "last_used": {
      "$ref": "common.schema.json#/definitions/date_time"
    },
    "auth_material": {
      "$ref": "#/definitions/auth_material"
    },
    "identity": {
      "type": "object",
      "additionalProperties": false,
      "required": [
        "user_id",
        "display_name",
        "roles"
      ],
      "properties": {
        "user_id": {
          "$ref": "common.schema.json#/definitions/user_id"
        },
        "display_name": {
          "type": "string"
        },
        "roles": {
          "type": "array",
          "items": {
            "type": "string"
          }
        },
        "owned_resource_ids": {
          "type": "array",
          "items": {
            "oneOf": [
              {
                "type": "integer"
              },
              {
                "type": "string"
              }
            ]
          }
        }
      }
    },
    "status": {
      "type": "string",
      "enum": [
        "active",
        "expired",
        "error"
      ]
    }
  },
  "definitions": {
    "auth_material": {
      "type": "object",
      "additionalProperties": false,
      "required": [
        "type"
      ],
      "properties": {
        "type": {
          "type": "string",
          "enum": [
            "cookie",
            "bearer",
            "api_key",
            "custom",
            "mixed"
          ]
        },
        "cookie_header": {
          "type": "string",
          "minLength": 1
        },
        "headers": {
          "type": "object",
          "minProperties": 1,
          "additionalProperties": {
            "type": "string"
          }
        },
        "cookies": {
          "type": "array",
          "minItems": 1,
          "items": {
            "$ref": "#/definitions/cookie"
          }
        },
        "csrf": {
          "type": "object",
          "additionalProperties": {
            "type": "string"
          }
        },
        "storage": {
          "type": "object",
          "additionalProperties": {
            "type": "string"
          }
        }
      },
      "anyOf": [
        {
          "required": [
            "cookie_header"
          ]
        },
        {
          "required": [
            "headers"
          ]
        },
        {
          "required": [
            "cookies"
          ]
        }
      ]
    },
    "cookie": {
      "type": "object",
      "additionalProperties": false,
      "required": [
        "name",
        "value",
        "domain",
        "path"
      ],
      "properties": {
        "name": {
          "type": "string",
          "minLength": 1
        },
        "value": {
          "type": "string"
        },
        "domain": {
          "type": "string",
          "minLength": 1
        },
        "path": {
          "type": "string",
          "minLength": 1
        },
        "secure": {
          "type": "boolean"
        },
        "http_only": {
          "type": "boolean"
        },
        "same_site": {
          "type": "string",
          "enum": [
            "Strict",
            "Lax",
            "None",
            "Unspecified"
          ]
        }
      }
    }
  }
}
