{
  "role": "user1",
  "username": "user1",
  "role_level": "standard",
  "login_time": "2026-07-12T09:00:00+08:00",
  "last_used": "2026-07-12T10:00:00+08:00",
  "auth_material": {
    "type": "cookie",
    "cookie_header": "session=test"
  },
  "identity": {
    "user_id": 101,
    "display_name": "测试用户",
    "roles": [
      "user"
    ]
  },
  "status": "active"
}
